{
  "graph_version": "1.0.0",
  "name": "rocket-nozzle-graph",
  "nodes": [
    {
      "id": "chamber",
      "kind": "chamber",
      "ports": [
        {
          "id": "out",
          "name": "Chamber outlet",
          "kind": "fluid",
          "direction": "out",
          "required": true
        }
      ]
    },
    {
      "id": "nozzle",
      "kind": "nozzle",
      "ports": [
        {
          "id": "in",
          "name": "Nozzle inlet",
          "kind": "fluid",
          "direction": "in",
          "required": true
        },
        {
          "id": "out",
          "name": "Nozzle exit",
          "kind": "fluid",
          "direction": "out",
          "required": true
        }
      ]
    },
    {
      "id": "exhaust",
      "kind": "ambient",
      "ports": [
        {
          "id": "in",
          "name": "Exhaust sink",
          "kind": "fluid",
          "direction": "in",
          "required": true
        }
      ]
    }
  ],
  "edges": [
    {
      "from": { "node": "chamber", "port": "out" },
      "to": { "node": "nozzle", "port": "in" },
      "kind": "fluid"
    },
    {
      "from": { "node": "nozzle", "port": "out" },
      "to": { "node": "exhaust", "port": "in" },
      "kind": "fluid"
    }
  ]
}
